{
  "$schema": "./normalization-policy.schema.json",
  "policyVersion": "1.0.0",

  "content": {
    "preserveSegmentOrder": true,
    "combineTextSegments": true,
    "includeReasoningSummary": false,
    "maximumCandidates": 1
  },

  "structuredOutput": {
    "parseTextAsJson": "only-when-declared",
    "preserveOriginalText": true
  },

  "toolCalls": {
    "parseArguments": true,
    "retainArgumentsText": true
  },

  "usage": {
    "allowDerivedTotal": true,
    "allowEstimatedUsage": false
  },

  "rawResponse": {
    "retention": "hash-and-reference"
  },

  "unsupportedContent": {
    "disposition": "preserve-with-diagnostic"
  }
}
